"Amazon.com, Inc. 3.3%",20220630,Corporation,0.28,95.06,94.54,98.19,,,held_directly,336,125,70,"Amazon.com, Inc.",," $45,000,000,000 "," $2,500,000,000 ", $18 ," $2,628,303.10 ",,2022-04-13,SEC Registered,Bond - Corporate Bond,,,Consumer Cyclical,,,,,NA,,3.87,4.28,2027-04-13,3.93," 2,765,003 ",AA,4.6241,,,,DE,US,USD,DEV,Electronic Shopping and Mail-Order Houses,Nonstore Retailer,,,,,NA,NA,,,,,,023135CF1,US023135CF19,448422140,bucket_51_max
Transdigm Uk Holdings Plc 6.875%,20190630,Corporation,0.05,97.81,94.93,93.39,101.96,104.73,High Yield Bond Portfolio,232,24,70,Transdigm Uk Holdings Plc,,,,," $456,410.89 ",,2019-05-09,SEC Registered,Bond - Corporate Bond,,,Industrials,,,,,NA,,2.25,3.37,2026-05-15,2.95," 466,647 ",B,7.674,,,,,GB,USD,DEV,Other Aircraft Parts and Auxiliary Equipment Manufacturing,Transportation Equipment Manufacturing,,,,,NA,NA,,,,,,89365DAB9,US89365DAB91,174950347,bucket_51_max
Audacy Capital Corp 6.5%,20190630,Corporation,0.01,18.97,24.69,59.64,94.02,97.1,High Yield Bond Portfolio,278,20,70,Audacy Capital Corp,," $1,450,000,000 "," $362,500,000 ", $4 ," $97,295.21 ",,2019-04-30,Exempt Issue,Bond - Corporate Bond,,,Consumer Cyclical,,,,,NA,,2.21,4.33,2027-05-01,2.30," 512,827 ",Below B,62.4182,,,,DE,US,USD,DEV,Radio Networks,Broadcasting (except Internet),,,,,NA,NA,,,,,,29365DAA7,US29365DAA72,236907043,bucket_51_max
"Scientific Games International, Inc. 8.625%",20210331,Corporation,0.03,102.19,102.5,102.66,105.3,106.87,High Yield Bond Portfolio,228,35,70,"Scientific Games International, Inc.",," $5,026,745,903 "," $502,674,590 ", $10 ," $270,727.21 ",,2020-07-01,Exempt Issue,Bond - Corporate Bond,,,Industrials,,,,,NA,,1.19,2.50,2025-07-01,2.22," 264,920 ",B,7.7217,,,,DE,US,USD,DEV,All Other Business Support Services,Administrative and Support Services,,,,,NA,NA,,,,,,80874YBG4,US80874YBG44,319432790,bucket_51_max
Hess Corporation 5.6%,20180630,Corporation,0.41,94.97,87.72,97.62,112.65,123.91,held_directly,335,115,71,Hess Corporation,,,,," $3,911,661.99 ",,2010-08-10,SEC Registered,Bond - Corporate Bond,,,Energy,,,,,NA,,10.90,18.13,2041-02-15,11.07," 4,119,048 ",BBB,6.1026,,,,DE,US,USD,DEV,Support Activities for Oil and Gas Operations,Support Activities for Mining,,,,,NA,NA,,,,,,42809HAD9,US42809HAD98,8057748,bucket_51_max
Jefferies Group LLC/Jefferies Group Capital Finance Inc 2.625%,20211231,Limited Partnership,0.24,76.52,72.7,77.28,90.33,98.97,held_directly,277,85,71,Jefferies Group LLC/Jefferies Group Capital Finance Inc,," $266,692,000 "," $24,244,727 ", $11 ," $2,257,466.69 ",,2021-10-08,SEC Registered,Bond - Corporate Bond,,,Financial Services,,,,,NA,,7.44,8.79,2031-10-15,7.51," 2,950,032 ",BBB,6.158,,,,DE,US,USD,DEV,Securities Brokerage,"Securities, Commodity Contracts, and Other Financial Investments and Related Activities",,,,,NA,NA,,,,,,47233JGT9,US47233JGT97,411603194,bucket_51_max
Apple Inc. 1.65%,20220630,Corporation,0.49,80.74,79.02,84.18,90.13,97.54,held_directly,277,123,71,Apple Inc.," $2,750,000,000 "," $9,377,000,000 "," $1,875,400,000 ", $5 ," $4,602,155.61 ",0.21,2021-02-08,SEC Registered,Bond - Corporate Bond,Note,Senior,Technology,,,,,NA,1.65,7.27,8.11,2031-02-08,7.38," 5,700,038 ",AA,4.5553,,,,CA,US,USD,DEV,Radio and Television Broadcasting and Wireless Communications Equipment Manufacturing,Computer and Electronic Product Manufacturing,,,,,No,NA,,,,,,037833ED8,US037833ED89,363146725,bucket_51_max
Cleveland-Cliffs Inc 4.875%,20210331,Corporation,0.01,88.44,82.75,88.39,99.09,104.15,High Yield Bond Portfolio,337,16,71,Cleveland-Cliffs Inc," $500,000,000 "," $6,907,568,000 "," $460,504,533 ", $15 ," $113,927.88 ",0.03,2021-02-17,Exempt Issue,Bond - Corporate Bond,Note,Senior,Basic Materials,,,,,NA,4.875,5.96,8.17,2031-03-01,6.51," 128,814 ",BB,6.7611,,,,OH,US,USD,DEV,Support Activities for Metal Mining,Support Activities for Mining,,,,,No,NA,,,,,,185899AL5,US185899AL57,364375375,bucket_51_max
TransAlta Corporation 7.75%,20221231,Corporation,0.00,102.26,,,,,High Yield Bond Portfolio,240,17,71,TransAlta Corporation,,,,," $12,427.24 ",,2022-11-17,SEC Registered,Bond - Corporate Bond,,,Utilities,,,,,NA,,3.98,6.88,2029-11-15,5.28," 12,152 ",BB,7.3479,,,,AB,CA,USD,DEV,Other Electric Power Generation,Utilities,,,,,NA,NA,,,,,,89346DAH0,US89346DAH08,488052321,bucket_51_max
Real Hero Merger Sub 2 Inc. 6.25%,20210331,Corporation,0.03,68.68,72.34,75.98,91.31,99.98,High Yield Bond Portfolio,362,21,71,Real Hero Merger Sub 2 Inc.,,,,," $287,108.72 ",,2021-01-29,Exempt Issue,Bond - Corporate Bond,,,Industrials,,,,,NA,,4.44,6.09,2029-02-01,4.60," 418,038 ",Below B,14.1177,,,,DE,US,USD,DEV,All Other Business Support Services,Administrative and Support Services,,,,,NA,NA,,,,,,75602BAA7,US75602BAA70,361169966,bucket_51_max
Rackspace Technology Global Incorporated 5.375%,20201231,Corporation,0.03,43.75,47.19,65.49,86.95,97.64,High Yield Bond Portfolio,331,38,71,Rackspace Technology Global Incorporated,,,,," $286,018.88 ",,2020-12-01,Exempt Issue,Bond - Corporate Bond,,,Consumer Cyclical,,,,,NA,,4.14,5.92,2028-12-01,4.16," 653,793 ",Below B,23.4825,,,,DE,US,USD,DEV,All Other Information Services,Other Information Services,,,,,NA,NA,,,,,,750098AA3,US750098AA35,350408262,bucket_51_max
Citigroup Inc. 4.3%,20180630,Corporation,0.29,96.88,94.76,98.64,103,110.58,held_directly,360,114,71,Citigroup Inc.," $1,000,000,000 "," $184,072,858,362 "," $148,805,868 "," $1,237 "," $2,712,498.11 ",0.28,2014-11-20,SEC Registered,Bond - Corporate Bond,Note,Subordinated,Financial Services,,,,,NA,4.3,3.50,3.89,2026-11-20,3.53," 2,799,965 ",BBB,5.2378,,,,DE,US,USD,DEV,Commercial Banking,Credit Intermediation and Related Activities,,,,,No,NA,,,,,,172967JC6,US172967JC62,56392394,bucket_51_max
OI European Group B.V. 4.75%,20211231,Corporation,0.02,87.71,79.74,83.88,93.1,101.5,High Yield Bond Portfolio,239,26,72,OI European Group B.V.,,,,," $193,999.42 ",,2021-11-16,Exempt Issue,Bond - Corporate Bond,,,Industrials,,,,,NA,,5.40,7.13,2030-02-15,5.84," 221,172 ",BB,6.9935,,,,,NL,USD,DEV,Offices of Other Holding Companies,Management of Companies and Enterprises,,,,,NA,NA,,,,,,67777LAD5,US67777LAD55,417999568,bucket_51_max
The Dun & Bradstreet Corporation 5%,20211231,Corporation,0.01,85.71,82.71,86.51,94.11,102.37,High Yield Bond Portfolio,329,16,72,The Dun & Bradstreet Corporation,,,,," $58,325.50 ",,2021-12-20,Exempt Issue,Bond - Corporate Bond,,,Industrials,,,,,NA,,5.44,6.96,2029-12-15,5.65," 68,053 ",B,7.7171,,,,DE,US,USD,DEV,Credit Bureaus,Administrative and Support Services,,,,,NA,NA,,,,,,26483EAL4,US26483EAL48,424404221,bucket_51_max
Cornerstone Building Brands Inc 8.75%,20220930,Corporation,0.01,91.89,82.56,,,,High Yield Bond Portfolio,300,28,72,Cornerstone Building Brands Inc," $710,000,000 "," $3,710,000,000 "," $618,333,333 ", $6 ," $111,670.31 ",0.02,2022-07-25,Exempt Issue,Bond - Corporate Bond,Note,Senior Secured,Industrials,,,,,NA,8.75,3.91,5.59,2028-08-01,4.09," 121,523 ",,10.7488,,,,DE,US,USD,DEV,Offices of Other Holding Companies,Management of Companies and Enterprises,,,,,No,NA,,,,,,13323NAA0,US13323NAA00,465914542,bucket_51_max
Consensus Cloud Solutions Inc 6%,20210930,Corporation,0.02,93.95,88.67,86.18,99.37,104.12,High Yield Bond Portfolio,258,14,72,Consensus Cloud Solutions Inc," $305,000,000 "," $1,610,000,000 "," $402,500,000 ", $4 ," $157,556.44 ",0.05,2021-10-07,Exempt Issue,Bond - Corporate Bond,Note,Senior,Technology,,,,,NA,6,3.15,3.79,2026-10-15,3.30," 167,701 ",B,8.0097,,,,DE,US,USD,DEV,Software Publishers,Publishing Industries (except Internet),,,,,No,NA,,,,,,20848VAA3,US20848VAA35,407566849,bucket_51_max
"Gray Television, Inc. 5.875%",20180630,Corporation,0.03,89.25,92.39,93.62,102.55,103.36,High Yield Bond Portfolio,155,31,72,"Gray Television, Inc.",," $1,050,000,000 "," $525,000,000 ", $2 ," $290,670.31 ",,2016-06-14,Exempt Issue,Bond - Corporate Bond,,,Consumer Cyclical,,,,,NA,,2.98,3.54,2026-07-15,3.08," 325,681 ",B,9.5774,,,,GA,US,USD,DEV,Television Broadcasting,Broadcasting (except Internet),,,,,NA,NA,,,,,,389375AJ5,US389375AJ52,97881944,bucket_51_max
United Shore Financial Service Llc 5.5%,20201231,Limited Partnership,0.03,90.21,87.37,85.84,97.17,101.98,High Yield Bond Portfolio,285,38,72,United Shore Financial Service Llc,,,,," $243,363.60 ",,2020-11-03,Exempt Issue,Bond - Corporate Bond,,,Financial Services,,,,,NA,,2.54,2.88,2025-11-15,2.57," 269,781 ",BB,9.5281,,,,DE,US,USD,DEV,Other Activities Related to Credit Intermediation,Credit Intermediation and Related Activities,,,,,NA,NA,,,,,,91153LAA5,US91153LAA52,347251001,bucket_51_max
American Tower Corporation 5%,20180630,REIT,0.14,99.68,100.02,101.23,103.48,107.69,held_directly,284,92,72,American Tower Corporation,," $10,576,011,361 "," $705,067,424 ", $15 ," $1,360,553.40 ",,2013-08-19,SEC Registered,Bond - Corporate Bond,,,Real Estate,,,,,NA,,1.06,1.13,2024-02-15,1.08," 1,364,976 ",BBB,5.3361,,,,DE,US,USD,DEV,Lessors of Residential Buildings and Dwellings,Real Estate,,,,,NA,NA,,,,,,03027XAD2,US03027XAD21,23641635,bucket_51_max
Molson Coors Beverage Company 4.2%,20180630,Corporation,0.05,77.98,74.4,82.31,97.32,111,held_directly,365,125,73,Molson Coors Beverage Company," $1,800,000,000 "," $5,785,798,437 "," $1,446,449,609 ", $4 ," $475,654.47 ",0.03,2016-07-07,SEC Registered,Bond - Corporate Bond,Note,Senior,Consumer Defensive,,,,,NA,4.2,13.27,23.54,2046-07-15,13.52," 610,001 ",BBB,5.9924,,,,DE,US,USD,DEV,Breweries,Beverage and Tobacco Product Manufacturing,,,,,No,NA,,,,,,60871RAH3,US60871RAH30,99425972,bucket_51_max
Olympus Water US Holding Corp. 6.25%,20210930,Corporation,0.04,76.05,68.7,69.62,88.69,97.64,High Yield Bond Portfolio,223,16,73,Olympus Water US Holding Corp.,,,,," $419,581.43 ",,2021-10-01,Exempt Issue,Bond - Corporate Bond,,,Industrials,,,,,NA,,5.03,6.75,2029-10-01,5.12," 551,713 ",Below B,11.4642,,,,DE,US,USD,DEV,Offices of Other Holding Companies,Management of Companies and Enterprises,,,,,NA,NA,,,,,,681639AB6,US681639AB60,403328835,bucket_51_max
Academy Ltd / Academy Finance Corp. 6%,20201231,Corporation,0.02,95.88,90.9,91.54,102.5,106.65,High Yield Bond Portfolio,308,15,73,Academy Ltd / Academy Finance Corp.," $400,000,000 "," $800,000,000 "," $400,000,000 ", $2 ," $170,114.44 ",0.04,2020-11-06,Exempt Issue,Bond - Corporate Bond,Note,Senior Secured,Consumer Cyclical,,,,,NA,6,3.56,4.88,2027-11-15,4.14," 177,423 ",BB,7.046,,,,TX,US,USD,DEV,Men's Clothing Stores,Clothing and Clothing Accessories Store,,,,,No,NA,,,,,,00401YAA8,US00401YAA82,346866209,bucket_51_max
Cheever Escrow Issuer LLC 7.125%,20220930,Limited Partnership,0.00,95.88,89.63,,,,High Yield Bond Portfolio,285,10,73,Cheever Escrow Issuer LLC,,,,," $20,972.78 ",,2022-08-30,Exempt Issue,Bond - Corporate Bond,,,Industrials,,,,,NA,,3.60,4.75,2027-10-01,3.94," 21,874 ",B,8.3482,,,,DE,US,USD,DEV,All Other Business Support Services,Administrative and Support Services,,,,,NA,NA,,,,,,16308NAA2,US16308NAA28,471776088,bucket_51_max
Gates Global Llc/Gates Global Co. 6.25%,20191231,Limited Partnership,0.06,96.66,92.12,92.89,100.27,103.36,High Yield Bond Portfolio,204,33,73,Gates Global Llc/Gates Global Co.,,,,," $552,051.81 ",,2019-11-22,Exempt Issue,Bond - Corporate Bond,,,Industrials,,,,,NA,,2.28,3.04,2026-01-15,2.71," 571,157 ",B,7.5579,,,,DE,US,USD,DEV,All Other Miscellaneous General Purpose Machinery Manufacturing,Machinery Manufacturing,,,,,NA,NA,,,,,,36740LAA0,US36740LAA08,275677576,bucket_51_max
Trident TPI Holdings Inc 9.25%,20190930,Corporation,0.01,95.74,92.27,91.63,100.62,104.62,High Yield Bond Portfolio,224,13,73,Trident TPI Holdings Inc,,,,," $74,458.37 ",,2019-07-24,Exempt Issue,Bond - Corporate Bond,,,Basic Materials,,,,,NA,,1.36,1.59,2024-08-01,1.42," 77,775 ",Below B,12.7899,,,,DE,US,USD,DEV,All Other Converted Paper Product Manufacturing,Paper Manufacturing,,,,,NA,NA,,,,,,89616RAB5,US89616RAB50,251394087,bucket_51_max
Ryan Specialty Group LLC 4.375%,20220630,Limited Partnership,0.01,86.71,84.94,87.12,94.62,,High Yield Bond Portfolio,323,12,74,Ryan Specialty Group LLC,,,,," $82,194.82 ",,2022-02-03,Exempt Issue,Bond - Corporate Bond,,,Financial Services,,,,,NA,,5.50,7.09,2030-02-01,5.89," 94,788 ",BB,6.7895,,,,DE,US,USD,DEV,Insurance Agencies and Brokerages,Insurance Carriers and Related Activities,,,,,NA,NA,,,,,,78351MAA0,US78351MAA09,431943237,bucket_51_max
Western Midstream Operating  LP 4.5%,20200630,Limited Partnership,0.01,92.29,90.64,90.66,102.19,109.05,High Yield Bond Portfolio,215,22,74,Western Midstream Operating  LP,," $500,000,000 "," $500,000,000 ", $1 ," $118,887.72 ",,2018-03-02,SEC Registered,Bond - Corporate Bond,,,Utilities,,,,,NA,,4.40,5.17,2028-03-01,4.50," 128,814 ",BB,6.3977,,,,DE,US,USD,DEV,Natural Gas Distribution,Utilities,,,,,NA,NA,,,,,,958254AH7,US958254AH78,164842278,bucket_51_max
Urban One Inc 7.375%,20210331,Corporation,0.02,84.66,85.12,85.76,100.53,103.15,High Yield Bond Portfolio,286,21,74,Urban One Inc,,,,," $205,752.63 ",,2021-01-25,Exempt Issue,Bond - Corporate Bond,,,Consumer Cyclical,,,,,NA,,3.88,5.09,2028-02-01,4.02," 243,046 ",B,11.4694,,,,DE,US,USD,DEV,Radio Networks,Broadcasting (except Internet),,,,,NA,NA,,,,,,91705JAC9,US91705JAC99,358506721,bucket_51_max
Southern Co. 3.25%,20180630,Corporation,0.32,94.16,92.76,95.88,100.15,106.03,held_directly,296,103,74,Southern Co.," $1,750,000,000 "," $13,945,432,542 "," $996,102,324 ", $14 ," $2,998,950.32 ",0.18,2016-05-24,SEC Registered,Bond - Corporate Bond,Note,Senior,Utilities,,,,,NA,3.25,3.16,3.50,2026-07-01,3.25," 3,185,041 ",BBB,5.1339,,,,DE,US,USD,DEV,Other Electric Power Generation,Utilities,,,,,No,NA,,,,,,842587CV7,US842587CV72,96537013,bucket_51_max
Capital One Financial Corporation 4.2%,20180630,Corporation,0.12,96.74,96.26,98.83,102.4,108.8,held_directly,247,109,74,Capital One Financial Corporation,," $2,250,000,000 "," $1,125,000,000 ", $2 ," $1,160,850.43 ",,2015-10-29,SEC Registered,Bond - Corporate Bond,,,Financial Services,,,,,NA,,2.58,2.83,2025-10-29,2.62," 1,199,980 ",BBB,5.498,,,,DE,US,USD,DEV,Commercial Banking,Credit Intermediation and Related Activities,,,,,NA,NA,,,,,,14040HBJ3,US14040HBJ32,79871687,bucket_51_max
"Amerigas Partners, L.P./Amerigas Finance Corp. 5.5%",20180630,Limited Partnership,0.02,96.24,93,94.29,100.19,107.48,High Yield Bond Portfolio,164,37,74,"Amerigas Partners, L.P./Amerigas Finance Corp."," $700,000,000 "," $2,575,000,000 "," $643,750,000 ", $4 ," $201,154.74 ",0.03,2016-12-28,SEC Registered,Bond - Corporate Bond,Note,Senior,Consumer Cyclical,,,,,NA,5.5,2.14,2.39,2025-05-20,2.19," 209,019 ",BB,7.3131,,,,DE,US,USD,DEV,Fuel Dealers,Nonstore Retailer,,,,,No,NA,,,,,,030981AK0,US030981AK06,114667553,bucket_51_max
Telenet Finance Luxembourg Notes S.A.R.L 5.5%,20190630,Corporation,0.05,91,87.61,88.36,97.5,103.5,High Yield Bond Portfolio,180,18,75,Telenet Finance Luxembourg Notes S.A.R.L,,,,," $442,342.88 ",,2017-12-13,Exempt Issue,Bond - Corporate Bond,,,Industrials,,,,,NA,,4.08,5.17,2028-03-01,4.36," 486,091 ",BB,7.894,,,,,LU,USD,DEV,All Other Business Support Services,Administrative and Support Services,,,,,NA,NA,,,,,,,BE6300372289,148844980,bucket_51_max
Aercap Ireland Capital DAC 4.875%,20190331,Limited Partnership,0.06,99.09,98.45,99.54,101.39,106.45,held_directly,376,80,75,Aercap Ireland Capital DAC,," $1,350,000,000 "," $675,000,000 ", $2 ," $594,568.08 ",,2019-01-16,SEC Registered,Bond - Corporate Bond,,,Financial Services,,,,,NA,,0.96,1.05,2024-01-16,1.00," 600,047 ",BBB,5.8269,,,,,IE,USD,DEV,Mortgage and Nonmortgage Loan Brokers,Credit Intermediation and Related Activities,,,,,NA,NA,,,,,,00774MAK1,US00774MAK18,220157739,bucket_51_max
Diamond Sports Group LLC / Diamond Sports Finance Co 6.625%,20190930,Corporation,0.00,1.12,7.38,12.5,20.84,28.25,High Yield Bond Portfolio,271,34,75,Diamond Sports Group LLC / Diamond Sports Finance Co,,,,," $2,351.47 ",,2019-08-02,Exempt Issue,Bond - Corporate Bond,,,Consumer Cyclical,,,,,NA,,0.08,,2027-08-15,," 209,023 ",Below B,,,,,DE,US,USD,DEV,Sporting Goods Stores,"Sporting Goods, Hobby, Musical Instrument, and Book Store",,,,,NA,NA,,,,,,25277LAC0,US25277LAC00,250198273,bucket_51_max
Comcast Corporation 3.999%,20180630,Corporation,0.14,79.4,76.83,87.43,101.3,115.64,held_directly,301,109,76,Comcast Corporation,," $9,674,934,000 "," $1,209,366,750 ", $8 ," $1,371,337.93 ",,2017-12-14,SEC Registered,Bond - Corporate Bond,,,Communication Services,,,,,NA,,14.91,26.84,2049-11-01,14.91," 1,727,057 ",A,5.5133,,,,PA,US,USD,DEV,Cable and Other Subscription Programming,Broadcasting (except Internet),,,,,NA,NA,,,,,,20030NCE9,US20030NCE94,143008134,bucket_51_max
Equitrans Midstream Corporation 6.5%,20201231,Corporation,0.02,75.14,76.48,76.44,96.69,120.52,High Yield Bond Portfolio,186,25,76,Equitrans Midstream Corporation," $550,000,000 "," $6,200,000,000 "," $775,000,000 ", $8 ," $177,139.80 ",0.04,2018-06-25,SEC Registered,Bond - Corporate Bond,Note,Senior,Energy,,,,,NA,6.5,10.17,25.54,2048-07-15,10.49," 235,754 ",BB,9.0243,,,,PA,US,USD,DEV,Pipeline Transportation of Natural Gas,Pipeline Transportation,,,,,No,NA,,,,,,26885BAE0,US26885BAE02,182914538,bucket_51_max
Match Group Holdings II LLC 4.125%,20200331,Corporation,0.01,81.81,82.26,83.69,93.91,101.14,High Yield Bond Portfolio,361,29,76,Match Group Holdings II LLC,," $400,000,000 "," $400,000,000 ", $1 ," $141,180.62 ",,2020-02-11,Exempt Issue,Bond - Corporate Bond,,,Technology,,,,,NA,,6.06,7.59,2030-08-01,6.23," 172,562 ",BB,7.3218,,,,DE,US,USD,DEV,Custom Computer Programming Services,"Professional, Scientific, and Technical Services",,,,,NA,NA,,,,,,57665RAL0,US57665RAL06,291223709,bucket_51_max
PENN Entertainment Inc 4.125%,20210930,Corporation,0.02,79.13,76.68,76.02,89.63,97.15,High Yield Bond Portfolio,310,14,76,PENN Entertainment Inc," $400,000,000 "," $400,000,000 "," $400,000,000 ", $1 ," $234,633.84 ",0.07,2021-07-01,Exempt Issue,Bond - Corporate Bond,Note,Senior,Consumer Cyclical,,,,,NA,4.125,5.28,6.50,2029-07-01,5.43," 296,516 ",B,8.3792,,,,PA,US,USD,DEV,Hotels (except Casino Hotels) and Motels,Accommodation,,,,,No,NA,,,,,,707569AV1,US707569AV14,389148418,bucket_51_max
"Sinclair Television Group, Inc. 5.5%",20201231,Corporation,0.03,70.09,72.09,73.76,86.74,96.89,High Yield Bond Portfolio,325,29,76,"Sinclair Television Group, Inc.",," $3,250,000,000 "," $464,285,714 ", $7 ," $274,250.80 ",,2019-11-27,Exempt Issue,Bond - Corporate Bond,,,Consumer Cyclical,,,,,NA,,5.41,7.17,2030-03-01,5.42," 391,303 ",B,11.8404,,,,MD,US,USD,DEV,Television Broadcasting,Broadcasting (except Internet),,,,,NA,NA,,,,,,829259AY6,US829259AY67,275435680,bucket_51_max
Broadstreet Partners Inc 5.875%,20210630,Corporation,0.06,85.24,78.96,78.4,93.46,97.89,High Yield Bond Portfolio,335,19,76,Broadstreet Partners Inc," $400,000,000 "," $800,000,000 "," $400,000,000 ", $2 ," $598,714.03 ",0.18,2021-04-21,Exempt Issue,Bond - Corporate Bond,Note,Senior,Financial Services,,,,,NA,5.875,4.90,6.29,2029-04-15,5.03," 702,402 ",Below B,9.0255,,,,OH,US,USD,DEV,Insurance Agencies and Brokerages,Insurance Carriers and Related Activities,,,,,No,NA,,,,,,11135RAA3,US11135RAA32,374749418,bucket_51_max
Apple Inc. 2.8%,20220630,Corporation,0.46,63.78,62.58,71.94,86.3,98.94,held_directly,352,127,77,Apple Inc.," $1,750,000,000 "," $9,377,000,000 "," $1,875,400,000 ", $5 ," $4,384,573.02 ",0.39,2021-02-08,SEC Registered,Bond - Corporate Bond,Note,Senior,Technology,,,,,NA,2.8,19.19,38.11,2061-02-08,19.21," 6,874,973 ",AA,4.953,,,,CA,US,USD,DEV,Radio and Television Broadcasting and Wireless Communications Equipment Manufacturing,Computer and Electronic Product Manufacturing,,,,,No,NA,,,,,,037833EG1,US037833EG11,363146728,bucket_51_max
Broadcom Inc 3.75%,20210331,Corporation,0.08,69.47,65.79,74.25,89.87,104.59,held_directly,416,133,77,Broadcom Inc,," $45,194,379,000 "," $2,259,718,950 ", $20 ," $729,374.69 ",,2021-01-19,Exempt Issue,Bond - Corporate Bond,,,Technology,,,,,NA,,14.76,28.13,2051-02-15,14.86," 1,049,942 ",BBB,6.055,,,,DE,US,USD,DEV,Semiconductor and Related Device Manufacturing,Computer and Electronic Product Manufacturing,,,,,NA,NA,,,,,,11135FBG5,US11135FBG54,358061471,bucket_51_max
Roblox Corporation 3.875%,20211231,Corporation,0.02,78.95,81.58,81.36,93.66,101.6,High Yield Bond Portfolio,397,37,77,Roblox Corporation," $1,000,000,000 "," $2,000,000,000 "," $1,000,000,000 ", $2 ," $153,507.56 ",0.02,2021-10-29,Exempt Issue,Bond - Corporate Bond,Note,Senior,Industrials,,,,,NA,3.875,6.03,7.33,2030-05-01,6.08," 194,436 ",BB,7.7072,,,,DE,US,USD,DEV,All Other Business Support Services,Administrative and Support Services,,,,,No,NA,,,,,,771049AA1,US771049AA15,415441306,bucket_51_max
United Wholesale Mortgage LLC 5.75%,20211231,Limited Partnership,0.01,86.23,79.44,80.33,93,100.32,High Yield Bond Portfolio,279,33,77,United Wholesale Mortgage LLC," $500,000,000 "," $1,500,000,000 "," $500,000,000 ", $3 ," $106,886.27 ",0.02,2021-11-22,Exempt Issue,Bond - Corporate Bond,Note,Senior,Financial Services,,,,,NA,5.75,3.75,4.46,2027-06-15,3.77," 123,953 ",BB,9.6626,,,,DE,US,USD,DEV,Other Activities Related to Credit Intermediation,Credit Intermediation and Related Activities,,,,,No,NA,,,,,,913229AC4,US913229AC47,419090559,bucket_51_max
Abbott Laboratories 3.75%,20180630,Corporation,0.25,97.5,97.11,100.72,103.89,110.6,held_directly,260,116,77,Abbott Laboratories,," $818,429,000 "," $818,429,000 ", $1 ," $2,388,678.45 ",,2016-11-22,SEC Registered,Bond - Corporate Bond,,,Industrials,,,,,NA,,3.51,3.92,2026-11-30,3.60," 2,449,960 ",A,4.4938,,,,IL,US,USD,DEV,Offices of Other Holding Companies,Management of Companies and Enterprises,,,,,NA,NA,,,,,,002824BF6,US002824BF69,112671119,bucket_51_max
"TransDigm, Inc. 7.5%",20190930,Corporation,0.03,99.1,95.32,94.46,103.18,105.25,High Yield Bond Portfolio,301,35,77,"TransDigm, Inc.",," $11,950,000,000 "," $1,195,000,000 ", $10 ," $250,489.23 ",,2019-09-16,SEC Registered,Bond - Corporate Bond,,,Industrials,,,,,NA,,1.97,4.21,2027-03-15,3.55," 252,767 ",B,7.7951,,,,DE,US,USD,DEV,Other Aircraft Parts and Auxiliary Equipment Manufacturing,Transportation Equipment Manufacturing,,,,,NA,NA,,,,,,893647BH9,US893647BH98,256778639,bucket_51_max
Vici Properties Inc 4.5%,20220930,REIT,0.01,94.25,91.44,92.18,,,High Yield Bond Portfolio,295,11,77,Vici Properties Inc,,,,," $59,556.25 ",,2022-04-28,Exempt Issue,Bond - Corporate Bond,,,Real Estate,,,,,NA,,3.22,3.67,2026-09-01,3.31," 63,192 ",BBB,6.3219,,,,MD,US,USD,DEV,Lessors of Residential Buildings and Dwellings,Real Estate,,,,,NA,NA,,,,,,92564RAH8,US92564RAH84,448194602,bucket_51_max
Precision Drilling Corporation 7.125%,20180630,Corporation,0.03,96.91,93.94,94.13,102.12,102,High Yield Bond Portfolio,259,14,77,Precision Drilling Corporation,," $3,400,000,000 "," $377,777,778 ", $9 ," $242,596.49 ",,2017-11-22,Exempt Issue,Bond - Corporate Bond,,,Energy,,,,,NA,,2.20,3.04,2026-01-15,2.67," 250,337 ",B,8.3549,,,,AB,CA,USD,DEV,Drilling Oil and Gas Wells,Support Activities for Mining,,,,,NA,NA,,,,,,740212AL9,US740212AL91,146409923,bucket_51_max
Canadian Pacific Railway Company 3%,20211231,Corporation,0.10,75.81,71.08,78.4,90.17,101.83,held_directly,357,98,78,Canadian Pacific Railway Company,,,,," $940,051.40 ",,2021-12-02,SEC Registered,Bond - Corporate Bond,,,Industrials,,,,,NA,,13.52,18.92,2041-12-02,13.44," 1,239,941 ",BBB,5.0314,,,,AB,CA,USD,DEV,Line-Haul Railroads,Rail Transportation,,,,,NA,NA,,,,,,13645RBG8,US13645RBG83,419576370,bucket_51_max
"Alexandria Real Estate Equities, Inc. 1.875%",20200930,REIT,0.22,74.63,70.41,75.31,84.73,94.01,held_directly,323,109,78,"Alexandria Real Estate Equities, Inc.",," $951,000,000 "," $317,000,000 ", $3 ," $2,037,424.47 ",,2020-08-05,SEC Registered,Bond - Corporate Bond,,,Real Estate,,,,,NA,,8.71,10.09,2033-02-01,8.83," 2,730,052 ",BBB,5.1696,,,,MD,US,USD,DEV,Offices of Real Estate Agents and Brokers,Real Estate,,,,,NA,NA,,,,,,015271AV1,US015271AV11,326378463,bucket_51_max
UnitedHealth Group Inc. 2.3%,20220331,Corporation,0.38,83.59,80.64,86.71,94.05,101.89,held_directly,341,115,78,UnitedHealth Group Inc.,,,,," $3,552,745.31 ",,2021-05-19,SEC Registered,Bond - Corporate Bond,,,Financial Services,,,,,NA,,7.34,8.37,2031-05-15,7.41," 4,250,020 ",A,4.7329,,,,MN,US,USD,DEV,Direct Health and Medical Insurance Carriers,Insurance Carriers and Related Activities,,,,,NA,NA,,,,,,91324PED0,US91324PED06,381033931,bucket_51_max
Comcast Corporation 4.25%,20191231,Corporation,0.25,95.93,92.79,98.7,106.83,115.3,held_directly,305,103,78,Comcast Corporation,," $9,674,934,000 "," $1,209,366,750 ", $8 ," $2,398,138.56 ",,2018-10-05,SEC Registered,Bond - Corporate Bond,,,Communication Services,,,,,NA,,6.41,7.79,2030-10-15,6.53," 2,499,989 ",A,4.9257,,,,PA,US,USD,DEV,Cable and Other Subscription Programming,Broadcasting (except Internet),,,,,NA,NA,,,,,,20030NCU3,US20030NCU37,202735687,bucket_51_max
Foundation Building Materials Inc 6%,20210331,Corporation,0.04,75.32,73.18,73.4,90.19,98.39,High Yield Bond Portfolio,297,15,78,Foundation Building Materials Inc,,,,," $375,288.72 ",,2021-02-10,Exempt Issue,Bond - Corporate Bond,,,Basic Materials,,,,,NA,,4.68,6.17,2029-03-01,4.79," 498,243 ",Below B,11.8523,,,,DE,US,USD,DEV,"Lumber, Plywood, Millwork, and Wood Panel Merchant Wholesalers","Merchant Wholesalers, Durable Good",,,,,NA,NA,,,,,,350392AA4,US350392AA45,363146472,bucket_51_max
Western Midstream Operating  LP 5.3%,20200630,Limited Partnership,0.03,82.4,82.46,80.81,99.19,120.27,High Yield Bond Portfolio,222,22,79,Western Midstream Operating  LP,," $500,000,000 "," $500,000,000 ", $1 ," $280,377.97 ",,2018-03-02,SEC Registered,Bond - Corporate Bond,,,Utilities,,,,,NA,,12.41,25.17,2048-03-01,12.61," 340,264 ",BB,6.7814,,,,DE,US,USD,DEV,Natural Gas Distribution,Utilities,,,,,NA,NA,,,,,,958254AJ3,US958254AJ35,164842279,bucket_51_max
